{
  "defaultPolicy": {
    "tools": "ask",
    "bash": "ask",
    "mcp": "ask",
    "skills": "ask",
    "special": "ask"
  },
  "tools": {
    "read": "allow",
    "read:/home/alice/project/generated/*": "allow",
    "write": "deny"
  },
  "bash": {
    "git status": "allow",
    "git *": "ask"
  },
  "mcp": {
    "mcp_status": "allow"
  },
  "skills": {
    "*": "ask"
  },
  "special": {
    "doom_loop": "deny",
    "external_directory": "ask",
    "external_directory:/home/alice/shared/*": "allow"
  }
}
